id,comments
dl4fc4,YTA.  Opening a business is a risk but it also has its rewards.  Your GF is 30 and has a degree in business management.  This is a great time for her to give her own business a shot.  Not supporting her is an AH move.
dl4fc7,[deleted]
dl4hu0,"YTA - you're teaching your nephew to hide things from his mother. If she prefers that he doesn't eat fast food you should respect that, not encourage lying. And if you *really* thought it was an issue you could have spoken to her about it like an adult"
dl4i4r,"NAH but the buffet runners HATE it when people do this because it essentially fucks up the rest of the dish and when I worked in a a buffet we once had to throw out two entire trays of food because someone picked out all of one ingredient which was supposed to be the main deal (think of it like taking all the chicken out of the chicken stir fry so all that’s left is a shitty veggie stir fry that the entire thing is thrown away.)

So youre potentially wasting a LOT of food but neither you nor I would know for sure because neither of us work at those buffets."
dl4i7n,"Eh, yta. Just make some plans your friend can join and that are safer for everyone involved."
dl4iwm,"NTA

But, I’d make sure there were reasons other than getting away from them and avoiding them that you’re transferring. College is a big decision. 

I also wouldn’t ‘cut’ contact. Just don’t call them first. If they call you, try to be civil. Your brother will hopefully grow up to be less of an ass.  Moving away is a great way to limit contact without cutting them completely."
dl4k6s,NTA - she isn't entitled to having a bite of your half-burger lol
dl4pgz,"ESH

He sounds like an asshole.  Then again; so do you."
dl4ro5,"Gentle YTA. You need to deal with the real issue, which is your feelings of inadequacy in comparison to this friend. Asking them to change their name is only going to put a bandaid on an issue."
dl4u7z,YTA - Because you had the chance to have this out with your friend and haven't. Maybe try contacting them! Do it now!
dl539a,YTA. Making a flip remark like “when are you going to divorce him already” isn’t being supportive.
dl56qf,"YTA. Don't get me wrong, you don't have to go to a party if you don't want to, but your friends miss you and the only reason you're not going to hang out with them is because you can't be bothered to figure out a low-effort costume. The message to your friends is, ""yeah, I like hanging out with you until I have to put in effort or do something I'm not excited about."" Even if that's not totally true, I suspect that's how you're coming across. 

Not sure if you'd dress up as a male or female character, but here are some low effort ideas off the top of my head:

\- tape some white paper circles on a pair of glasses and go as a painting from [Big Eyes](https://en.wikipedia.org/wiki/Big_Eyes)

\- Wear blue and say you're Violet Beauregard from [Charlie and the Chocolate Factory](https://en.wikipedia.org/wiki/Charlie_and_the_Chocolate_Factory_(film)). Stuff a pillow under your shirt and you're blueberry Violet.

\- Wear black pants with a black shirt and say you're [Pierce Brosnan](http://www.horrordvds.com/reviews/a-m/marsattacks/marsattacks_shot9l.jpg) from Mars Attacks!. Bonus points if you find a pipe. Or plaid shirt + band shirt + jeans and you're Lucas Haas.

\- Khakis, glasses, black and white plaid shirt--Adam from [Beetlejuice](https://www.therpf.com/forums/attachments/tumblr_o3hk1edzmb1qjouuqo10_1280-jpg.844862/)."
dl575a,"NTA

I would have said N-A-H because of his sister visiting. Timing sucks, though he could have visited a bit at the house. However, his comments about her being dead for 10 years and that you're spoiled walked him right into AH territory. Not cool. And not a nice partner either."
dl57zx,"NTA 
And apparently your brother has decided he no longer wants Netflix access either"
dl58q2,"YTA

Obviously you were 15 once and you know how it is. I honestly wouldn’t have survived this long if I was constantly tracked at that age. Give your Son some privacy’s, the same privacy you expected at age 15."
dl59bv,NTA if you do it in a mature manner. Nothing wrong with telling them to please park a little closer to the edge. Just don't drop any F-bombs or any bad language.
dl5byv,"NTA: I would have said no assholes, but her lack of communication with you sort of ruins that.

I LARP as well, and those major events are time and cost consuming... She should have been more direct if this was going to be an issue for her."
dl5dms,"NAH

HOWEVER; don’t approach this yourself, go through HR. Tell them you exactly as you’ve said here"
dl5g6f,"Rookie mistake


YTA"
dl5kb2,"Nope, NTA. 

He made his bed, now he can lie in it."
dl5mfg,"
If you want your comment to count toward judgment, include *only ONE* of the following abbreviations in your comment. If you don't include a judgement abbreviation, the bot will ignore you when it looks for the top voted comment.


Judgment | Abbreviation
-- | :--:
**You're the Asshole** (& the other party is not) |**YTA**|
You're **Not the A-hole** (& the other party is) |**NTA**
**Everyone Sucks Here**|**ESH**
**No A-holes here**|**NAH**
**Not Enough Info**|**INFO**


#[Click Here For Our Full Rulebook](https://www.reddit.com/r/AmItheAsshole/wiki/index)

#[Click Here For Our FAQ](https://www.reddit.com/r/AmItheAsshole/wiki/faq)


*I am a bot, and this action was performed automatically. Please [contact the moderators of this subreddit](/message/compose/?to=/r/AmItheAsshole) if you have any questions or concerns.*"
dl5mr1,NTA. Your parents owe you proper medical care and the ability to decide that an activity is no longer suited to you.
dl5opq,"YTA - sometimes you have to just let your friends do what they are going to do. You can try to warm them, but at the end of the day it’s his choices and if his choices keep him from going to college then that’s his own fault."
dl5ou9,"YTA. They didn’t know he was coming I’m, and you react by being on the defense about how your relationship is worth the same. It sucks to get a gift from someone who doesn’t want to give a gift, you’re forcing the issue. You had no reason to be on the defense."
dl5ox5,"YTA: My brother used to uber, and they get penalized for low ratings like this. It genuinely affects their business. You can write comments, and the driver will get the comments.

If the ride was fine, but you didn't enjoy the radio, then comment on the RIDE (3 star rating), and why you gave them 3 stars.

1 star could really hurt them."
dl5qdm,[deleted]
dl5qds,"YTA just for this post. It's written as if you're intoxicated now, and not ""half a joint"" high. Your wife has 3 kids, I'm sure she's sick of looking after a 4th (you)."
dl5sj4,"NTA. I’m the same way with my wife and dog hair/grass. She needs to be considerate of your space, and hopefully you guys are close enough to have that discussion and set fair expectations of each other and hold each other accountable."
dl5u1r,Is everyone in this story 12?
dl5u3o,"YTA

You've got to face reality. After a certain age, people just don't care about birthdays as much. You can't force your values on others. If you want your birthday to be special, then you make it that way. Don't sit around expecting people to do it for you."
dl5ur3,"NTA, he promised and is now going back on it. You sure you want to be with someone who does this?"
dl5xrc,"NTA

Superstitions are for suckers. Professional gamblers don't worry about being a coward. They think the way you do."
dl5y2j,NTA. Your mother has turned into a terrible tenant. You’re well within your right to tell her she’s lived with you long enough and it’s time for her to go.
dl611s,"NTA. You already agreed to arrangements with your coworker, so you thought you knew what weekend you’d have off. So you booked according to what you thought was the plan. She can’t expect you to switch your flights along with their vacation that you planned after the first agreement. But I also don’t think they are the asshole either because from what you’ve written, it doesn’t necessarily seem like they’re expecting you to. It’s more like they’re just asking if it’s possible. I honestly think that the repercussions with your family for changing the dates would be more problematic than the repercussions with your coworker should you not change."
dl61c7,"NTA. You’re entitled to feel however you feel about this. What your dad did sucks, no question. But his failure to be a good husband doesn’t mean he failed to be a good father."
dl62tu,"NTA 

He should be wearing headphones. That’s standard form etiquette. 

Tell him he needs to wear them when you are home and if he doesn’t you will be talking to the RA"
dl66n3,"NTA.  If there was no way to tell who was at fault, you are absolutely not obligated to provide info.  And what responsible dog owner leaves a dog park to sit in his car while his dog is playing?  He is not in any position to point fingers,"
dl693a,"NTA.

That said, if you want to have your mom involved in your kids' lives and at your wedding, I think you're doing yourself a disservice by keeping your relationship hidden.  I agree your dad is a separate issue, but think about it from your mom's point of view.  She doesn't know you have a 5 year relationship.  If you don't tell her and get married in 2 years, she won't know that it will have been a 7 year relationship.  To her, you'll have just sprung this entire wedding thing out of nowhere.  If you tell her now, you might lose her.  *Or* you might be giving her time and motivation to come around.  I mean, it's a lot harder to say you don't want to be involved with abstract hypothetical grandbabies than it is real future grandbabies, if that makes sense.  

If you live close, maybe she would even be willing to do some family counseling with you and your partner?  Having a neutral 3rd party can be really helpful."
dl6954,"This woman has a massive victim complex, holy christ. How does anyone put up with her nonsense? PTSD? Really??? I have PTSD from being assaulted, so from my POV it's pretty shitty for her to say that what you did gave her PTSD. Someone needs to give this lady a wake up call. She gives me hives.

NTA"
dl6bdx,"YTA, she had a life before you, get over it."
dl6c9b,"NTA but anime isn’t the issue here.


He has personal problems that exist outside of anime and his addiction to it is the symptom, not the cause."
dl6cyy,I don't think anybody would be for visiting a friend IN THE HOSPITAL for an hour.  ESPECIALLY when it was already planned.  NTA
dl6djx,"NTA. For the love all things holy, tell her the truth. Your friends are idiots."
dl6dqq,"NAH: She misses her children, and this is reasonable. It sounds like you two are older teenagers possibly, and may be leaving home over the next few years to move on with your lives. She is just trying to make the time count now that there is an opportunity to do so.

You say you're declining every 1 or 2 days. That's a lot of nos. I'm not saying you need to spend two hours every day with her, but what about making time at dinner? What about asking her to play video games with you? What about asking her to watch a show that YOU want to watch?

I'm willing to bet she'll do what you two want to do, if you just give her the idea or suggestion. She just wants to spend time with you guys, and that's not unreasonable.

How many hours a day are you two just hanging around playing video games anyway? If it's several, then 2 hours isn't that unreasonable."
dl6ghn,"NTA

She has been a bad friend to you. There is no reason to keep hurting yourself by trying to be her friend."
dl6ip2,[deleted]
dl6j1c,"NTA. If your family members are that concerned, they are free to offer their own money and time."
dl6qc2,"NAH. He’s not wrong for asking, but you don’t have to loan your personal belongings if you’re not comfortable doing so."
dl6qz2,"NAH. 

Kiddos get sick. He is going to be in a loving, familiar environment. Go honor your dad. ❤️"
dl6sjv,Yta - it is fine to move the stuff but you at least should have told her first or given her the opportunity to reorganize it. It sucks that its cluttered but when you agree to ket people use your home or space that's one of the things you have to anticipate
dl6t74,"NTA - and if you guys are a serious couple, these early misconceptions can make for an awkward MIL/DIL relationship. If you aren't a serious couple, then don't worry about her. He's still a bit of an ass for allowing someone that he is close to to form an inaccurate picture of you."
dl6th5,NTA I have no tolerance for people who spew hate towards others based on religion. I would definitely report him or confront him and tell him that he can have his opinion but not to vocalize it with you.
dl6vb1,"NTA. If you can’t tell your girlfriend that she’s hurt you, you don’t have much of a relationship."
dl6zob,NTA. It doesn’t sound like this woman has changed her ways at all. She deserves to be reported for the way she treated you and your husband while meeting with you.
dl701j,"YTA. She wants to meet with you and your wife to make sure it's clear she's not there to hook up with you. As for the rest of it, get over yourself. She's a friend, not the love of your life. No one is obligated to attend your wedding, especially when they have to shell out for plane tickets. She has other people in her life who are more important to her than you are. I don't know why that's so shocking to you, but it's a you issue that you need to deal with."
dl70hd,Steamy drama man. YTA. Are you her ex or not? If so then its not exactally big news that she slept with you before they were together.
dl70zm,"NTA  


We aren't talking 50 cents. We are talking a difference of $1.5 per delivery. Assuming two a day (which is being extremely conservative), we are talking almos $100 per month."
dl72mr,"NAH. Sounds to me like he just wants to spend time with you doing something you both enjoy, but has become overbearing. Try finding some other things you both enjoy so you're no getting burnt out. Doing something you like so often will just make it a chore rather than a fun occassion."
dl733u,NTA but did you say this was college or middle school?
dl78b7,"NTA. If you’re grown enough to have a job, you’re grown enough to communicate with your boss and coworkers without your mom being involved."
dl78vu,YWNBTA but there may be legal implications involved here. Maybe pop on over to r/legaladvice and make sure it’s legally safe to do so. You can also call your local health department and see what options you have.
dl7eat,"Move the hell out. What a bloody ridiculous waste of your time. But as long as you are taking advantage of the free shelter, you can’t really complain it’s not fair."
dl7g5j,NTA.  They were offended because they made mistakes and didn't follow through with clarifying information they needed.  Don't mess with peoples checks!
dl7hdd,This is just going to turn into a childfree VS parents debate lol
dl7i9x,"NTA, I.. I'm a-loss for words. Except for: Your dad's a bitch. Get away from him."
dl7j6u,"YTA if you don't go, an hour drive really isn't that long and you can take a few hours out of a day to be there for your dad. Talk to your university and see if they are willing to make any accommodations for you to take the exams later for a family emergency."
dl7jq1,NTA that is disgusting  to do that
dl7laa,"YTA dude, it's fine to offer to babysit more for your brother but getting gifts in vastly different price ranges for two children with the same relationship to you is cruel. You didn't even get her an actual gift, just a gift card? Also, you're punishing her for what is almost certainly a parenting fail - kids who throw tantrums like that and use inappropriate language so young are usually victims of poor/neglectful parenting. Regardless, obviously playing favorites like this is not only rude, you are going to create resentment and bad blood between the two kids. Super unfair to both of them."
dl7nai,NTA. You should probably have treated him to ice cream after though.
dl7nrr,NTA but how long did you even know this person before getting married? Sounds like you two rushed into it recklessly and now you're realizing that he has either a spending addiction or at least horrible money management skills that are going to ruin your life if you stay. Time to find a way out of this marriage.
dl7o2o,NTA. I would stop playing with someone who had outbursts like that.
dl7ry2,"NTA. Abuse survivor here. I told a friend about my abuse in 5th grade (after I had already told my parents and abuser was out of the picture). Friend told his mom who called a mutual friend of my mom. Mom bitched me out for telling my friend because it made the family look bad. If ONE of those people had told a counselor, it would have been mandatorily reported and my abuser most likely would not be walking and living free. Unfortunately, my mother was too interested in protecting her reputation, so she never did anything about my abuse and he was never prosecuted (small town, abuser was a family member so same last name). I have never forgiven her. You did the right thing. The abuser deserves to be prosecuted. Someone can now step in and protect your friend the way she deserves."
dl7uko,"YTA - if you can’t afford to tip you can’t afford to order you cheapskate, drive to the place and pick it up yourself."
dl7wyy,"YTA

I expect this will get downvoted because this sub is very much “you don’t owe anyone shit”.

But the truth is in the real world if people throw you a party you’re supposed to nod and smile and pretend to enjoy it. Because it makes them happy. 

And sure maybe it’s not how you want to spend your birthday but making your whole family happy should be more important than how you spend your birthday.

Edit: Thank you kind redditors for the awards. I realize many, many of you disagree. I’m afraid I’m going to stop replying to the comments as it’s just getting exhausting. The lovely chaps who felt the need to message my inbox to tell me how much I suck - that was uncalled for - perhaps instead articulate your rationale in your own comment."
dl80xo,"NTA. You’re well within your right to question why somebody would spit on you, regardless of any disability they may have."
dl81cw,"Yta. Your kid gets to decide what he’s comfortable with, you don’t get to decide that for him. Consider yourself lucky that your ex is with someone who treats your child well."
dl83w5,Yta. You did a hit and run. You should be glad he didn’t press charges.
dl84nv,"NTA, and you're definitely overthinking this. They probably won't care."
dl8g69,NTA. You were honest about Max’s behavior and you were kind enough to do it out of earshot of the children. You did nothing wrong.
dl8jlb,"NTA. If your sister isn’t smart enough to realize that you can’t watch zombie shows in front of a toddler, she shouldn’t be watching tv in the common areas of your home."
dl8onv,"NAH. She is allowed to be upset, because she is a child who is upset at not being allowed to go. She feels like this is an injustice, and she may feel that you don’t trust her, and she may feel left or at school/betrayed by her mom. All of those feelings are normal for her. BUT: This is a good opportunity to sit her down and teach her about “sketchy” parties versus “safe” parties. Don’t have this conversation when she’s upset, wait a couple days. Walk her through why you thought this party was “sketchy”. Keep the focus on her safety, and teaching her “warning signs”. Good luck edit: maybe if she responds well, you can even help her host a “safe” party for Halloween. Teach her how to keep herself and her guests safe. And definitely revisit this conversation in the future, maybe around 7th or 8th grade, adding in drug and alcohol safety, and information about sexual assault."
dl8pzf,"Based solely on how you worded it, you’re the asshole. I understand the need to want to spend something on yourself, especially considering the money isn’t something that you were planning on it anyway, i.e. paychecks or bonuses or things of that nature. I do question though, are you the only one that is going to be able to use the computer, or would it in fact be a computer that you purchased for yourself that the family still uses. But the fact that you want to spend money on yourselfI don’t find to be terribly upsetting. Like I say for me YTA simply because of how you worded it."
dl8rgt,"YTA. Not only do you make him sleep in his dead mothers room, but you also use it for storage? That’s not okay."
dl8sek,Going with NTA. I think people are getting hung up the drugs part. If she was just drunk would it have been ok? To everyone saying she’s the ass hole is she just supposed to not go out at all anymore? Thats like saying it wasnt my turn to watch the kid so I decided to go out and drink with a few friends and got a little drunk and then my ex yelled at me for it saying I had a kid and so I can’t do that. Thats pretty ridiculous IMO she is still allowed to have fun and was essentially “off the clock” because her ex had the kid. I know parenting comes with some sacrifice but you can’t just sit at home and be available 24/7 waiting for something to happen.
dl8yno,"YTA - you broke someone else's belonging and your response is ""well they should be more careful?""

holy moly"
dl8zex,"NAH - Regardless whether or not she has a disability, she is still disrupting others around her. I don’t want to call her an asshole because maybe she simply isn’t aware of what she’s doing. She very well could be, which would make her an asshole, but it also sounds like she hasn’t been given the proper resources to combat this disability (as you suggested). 

So, no - just because someone has a disability doesn’t mean you must sacrifice your own well-being. Although - could you just move if she’s sitting near you?"
dl909p,"NTA,  I do not believe that all things have to be 100% equal across the board for siblings. But i mean that more in the way that one may need more than others throughout life. however this is really not one of those occasions. this is an obvious assistance for wedding finance and gifting that’s a clear snub to your husband. from his own family no less. I think it’s normal that you’re upset on your husband behalf as he’s feeling down and hurt by their actions. And I imagine that it’s not the actual money but the consideration in general."
dl92d7,"You're N T A for feeling that way but dear God have some tact, don't tell your wife that you have a favourite! Some things *really* need to be left unspoken and this is one of them! Also if you can identify that sometimes you show favouritism, the boys will be able to pick up on it too, so cut that shit out. You're allowed to have a favourite but the children should never know it. You got a lot of grovelling to do bud."
dl936x,NTA. Your grandma was wrong to try to get you to keep secrets for her and wrong to take your money. See if you can get an account in your own name now so that she doesn't do this again.
dl93yz,"NTA. 

If he’s a cool dude he should just be like “my bad you’re right, I forgot you didn’t really like plays” then maybe he could return them or something. Worse comes to worse you guys go and try to make a fun night out of it. It couldn’t be the worst!"
dl94qt,"YTA. She was writing a paper, which is why she couldn't giver you her undivided attention. That and you aren't a four year old."
dl9aar,"> as she naturally exudes a lot of body heat. 

We all exude body heat.  That's why we need to wear jackets in cold weather."
dl9abk,"NTA. If the drying cycle is done, the dryer should be fair game. If she over packs the machine and has damp clothing, she should be on top of her game to make try and get down there and add more time if necessary."
dl9amf,"NTA, my family used to do this too. It's a common thing and nothing to be ashamed of! We all need a little help sometimes."
dl9azy,"Is it counter service? If so, NTA. Its nice but most places like that don't expect tips. After working at one I hate the swivel thing cause it makes shit awkward for the customer and employee since no one really knows the social norms for such situations."
dl9bxo,NTA you didn't want her there and just wanted to spend time with your dad but he brought her with him anyway.
dl9etj,NTA you were just trying to convince her to give you at least one reason not to fail her you were being nice really. She watched a film and you asked for any views on it and clarified she just needed to say something not submit a well written review. She is being weird about it surely even someone who wasn't really watching would try to bullshit their way to a slightly better grade. I wonder if you were right about her having an issue if she is normally a engaged and happy student.
dl9h6v,Two words - CASH BAR.  Those who wish to imbibe may and those who wish to abstain will. NAH
dl9hb9,YTA Racism isn’t okay. Ever.
dl9hd5,"NAH. She may be worried about you and wanting to help. Or, as a recovering anorexic, she may feel a sort of competition with you. If she sees that you are getting slimmer, it may be affecting the way she sees herself, and she may be wanting to stop you from becoming slimmer than her, which may be why she's consistantly offering you food...a round about way to protect herself from relapsing. But you're not an asshole for wanting her behavior to stop and for telling her to stop."
dl9hjc,"Second hand camera equipment is the norm for ametures and budding professionals.

I'm assuming you're going to include lenses with the gift.  Maybe, if you're feeling bad, buy a new camera bag to go with the gift."
dl9jta,"YTA for having these arguments at all. Let your sister live her own life, and take care of yours."
