id,comments
dhio14,NTA Is she expecting everyone to give her rides everywhere when she travels as a family? That's odd. Is there no public transportation?
dhip6u,"> maybe I have a problem, maybe I’m addicted to sex or pornography, this are question I don’t have the answers to

These might be questions you should find out the answer to. 3-4 times a day is a LOT of sex, even for the beginning of a relationship. And correct me if I'm wrong, but it sounds like at least once you were watching porn on your phone while in her company? Also, live cams are not the same as regular porn given the interaction component and I'm not surprised she's upset about those especially if it's a recurring issue.

I'm gonna say YTA because it does sound like you have a real problem and you seem to be aware that might be the case, so get evaluated and get some help if you need it."
dhipqr,NTA. You're allowed to make noise in your apartment.
dhirwi,"YTA, obviously. You moved away from your children and started a new life without them, and then have the audacity to get upset that they resent you for it. You don’t think the 18 and 17 year olds you abandoned needed you as much as your 5 year old does?"
dhitby,"NTA

What the hell...she purchased a gift for herself, not you."
dhivxy,[deleted]
dhiwcu,NTA because she could have been a big girl and used her big girl words to let you know she was intending to get them and was only waiting for someone to come reach them for her.
dhiwjl,NTA surely it's disrespecting her religion more if you pray even though you don't believe in it?
dhiyn5,"NTA - As a person who grew up with a father who was *a bad person*, **morally, and ethically**, but not abusive, or necessarily criminal, I understand. I don't want my father in my, or my child's life, either. You have the right to say ""This person causes me harm"" / ""This person is toxic in my life"", and choose not to interact with them, and any attempt to undermine this is basic manipulative gaslightling. It's mildly abusive, and not okay. Your boundaries with your family are not strictly speaking her business, if they are no longer part of your life."
dhj02y,"NTA, you want to talk big like a man expect it back"
dhj2gd,"I'm gonna say YTA, but hear me out. You are of course not the asshole for having this sensitivity or communicating / enforcing this rule. 

HOWEVER. People are sensitive about sex and their bodies, even men, and the way you wrote this post is pretty... insensitive. I get that your nose is hypersensitive and I'll buy that, but that isn't common, and so what your boyfriend is going to be *experiencing* whether you intend it or not is your constant disgust with his odor / genitals, especially in instances where he showered only hours prior. That's going to make him feel hurt and likely defensive, especially if you speak to him about this as abrasively as you write about it in this post.  

If you care about your partner and your relationship, you'd do well to exercise sensitivity about this subject with him, and try to find ways to make it (1) clear that this is your thing and not about him, and (2) make it sexy - remind him to shower so you can go crazy on him after, or join him in the shower once in a while. 


To be clear - he has no right to be pushy about sex and try to get you to do things you don't want - but you should also take care not to say things like ""tough luck"" and ""I want to wretch"" in reference to this issue if you want to have a healthy & loving sex life with this man."
dhj38r,"I’m leaning towards YTA. Even though your dad bought the cat for your family, you forfeited your rights when you didn’t care what happened to your cat FOR YEARS. During this time, your cat was taken care of by another family who seems to care about it much more than you do. 

Also, if you truly worried about your cat, you wouldn’t have let it outdoors laissez-faire like that. Indoor cats are from disease and accidents and can live a fulfilling life with the right care and entertainment."
dhj47i,"NAH but it's not really a big deal to throw in your well wishes even though they're repetitive. If you feel like saying ""happy birthday"" is too chorus-y, switch it up. Ask them if they've had a good birthday, if they're doing anything to celebrate."
dhj6ux,"NAH. He’s a little kid who was trying to be friendly, but didn’t know better. You could have used a nicer tone, but he needs to learn that’s inappropriate, so no big deal. Just try to be nicer if a similar situation every arises. Remember they don’t know bette rand they’re just trying to be friendly. They should absolutely be corrected, but preferably in a nice tone. I don’t blame you for accidentally snapping though because nobody wants someone grabbing their belt and it can be a very instinctual reaction."
dhj7ue,"NTA. If everyone is aware of your birthday, than it's not your fault you don't want to spend the day of YOUR BIRTHDAY with them. Your partner knew your plans, he's the asshole."
dhj9c3,"So you'll continue justifying driving against the flow of traffic, which you know could cause an accident, however unlikely it might be, because it's more convenient? 

YTA. Please stop before you seriously injure someone."
dhjalp,"NTA, she was way worse in that situation, getting very personal. You made a throwaway comment that happens online all the time."
dhjayw,"NTA. At 2, Ava won't enjoy having to sit still and be quiet (if her mom bothers to tell her so), and she's too young to remember it when she grows up anyway."
dhjbhd,"YTA but only a little bit - all the way through I was wondering if you'd even bothered to ask if she could come  - seeing that you didn't and vaguely know you should have is what landed me at my judgement. 

If you hadn't done the international thing I'd agree it's unreasonable for her to want to go on every trip with you, but that's clearly a huge hurdle in your relationship that you're both still recovering from - during this recovery period you do have to make a visible concerted effort to make her feel wanted and included. 

She was specifically excited about accompanying you to out of state tournaments, it's not like you can say she wouldn't have been interested

I kind of sympathise with her too - I had a similar but different thing happen and while I'm ""over"" it it still takes effort not to blow up when they talk about the trip

Also, this is totally unsolicited advice, but this far into a relationship, where travel is an important emotional topic, you might do well to start checking in with her before you say yes to things. It might lead to less friction - instead of just saying yes to your friends then telling your significant other ""I'm going on a trip next weekend"" it would be far more considerate to tell your friends you need to check your schedule, finding out if there's a way to bring your girlfriend along unobtrusively, then go to your gf and say ""some tournament friends have invited me along to a tournament to cut costs, but there's only one spot - do we have any plans I'm forgetting about next weekend because I'd really like to go"" might get you wayyyy farther"
dhjhaj,"NTA. However if this is someone you still want to be friends with you need to be really careful in passing across this message. I’d say have the conversation one more time with her letting her know, that if this pattern continues you would need to have your space back explaining the situation with work and all."
dhjiq3,"NTA but it's kind of besides the point. There are clearly systemic staffing / management issues there that you sticking around to serve wouldn't have helped, especially while injured and recovering. 

If your GM / corporate don't understand that there's a larger issue and instead want to pin it all on you not working your 25th hour in 48, then this isn't a place you want to be working anyway."
dhjlnv,"Yes YTA, holy hell.

Your stepson is suffering from an embarrassing problem and is twice as frustrated as you that he can't control his incontinence. Instead of being helpful and understanding, you're upset that he's upset about something he can't control. 

And make no mistake-- him saying that he's ""been doing it on purpose"" is a way for him to regain some semblance of control over his bladder. Instead of seeing it for the cry for help it is, you're ""fed up."" 

And you want to buy him pampers instead of toys to humiliate and punish him. That's a *child.* And you're a huge asshole."
dhjmal,"ESH. Him for just being a jerk, you for reinforcing stereotypes that literally get dogs killed."
dhjmi4,NTA. You agreed to stay on for a time to help them out as a show of good faith. They're punishing your good deed.
dhjpuv,"ESH. You knew she didn’t want other people to see the picture and you sent it anyway. Even if you didn’t think it’s a big deal, she is self conscious of it. Also, F2 probably felt bad about accidentally sending it out, which is why she may be siding with F1. F1, in my opinion, is blowing this way out of proportion, but maybe she has a really good reason for hating that picture we don’t know about. 

I would apologize again and say you didn’t know how much it would bother her and if you had known you wouldn’t have sent it. And that you value your friendship and would like to move forward. If she is still upset after all that time and a second apology, I’m not sure what to do."
dhjqbb,"Your partner cares more about competing with their siblings than taking a comfortable, financially sound next step with their partner. I hope you think twice about marrying this person."
dhjs9o,"NTA, not your fault he choose to go no vacation not pay down his debt and let it grow"
dhjsok,"NTA if he'd booked it just for himself and cancelled with less than 24 hours notice there are barely any hotels that would have given him a refund, why should you pay extra because he cancelled?"
dhjtdl,"NTA. Look, you are *definitely* overreacting. A cooked turkey heart is gross, but not cry-in-the-bathroom traumatizing. Your grandmother should have apologized as it was a mean thing to do in light of your sensitivity to gross things, but it was a *joke.* Next time, just verbalize your feelings instead of resorting to giving your grandma the cold shoulder."
dhjuxz,"NTA; at first neighbors were right to not let you in seeing as they didn't know who you were. After that they became very petty and imo, bitchy. For your sake I hope they lock themselves out of their flat one day."
dhk2ex,NTA - Having autism doesn’t mean you can be a shitty person
dhk2vh,"NTA. 

It's called Monopoly, not Corporation. It's literally meant for 1 single person to win, not two or a group. It's one thing when it was just between the both of them, but when it starts affecting other people's ability to win the game, it's too far."
dhk2y2,NTA. That’s ridiculous that she needs to enjoy it or she can’t do it... the world doesn’t revolve around you
dhk3hk,[deleted]
dhk8jj,"NTA - your friend is annoying and your other friends are reading way too into things if that’s what they got from you telling her to let it go.


And also, get a case for your phone you animal."
dhkb4p,"Definitely YTA, and I think you know it based on your attempt to justify why you took the money in this post.

EDIT: your double TA now that we know that this guy giving you money has a crush on you."
dhkcj3,"You’d be the ass if you weren’t annoyed by this guy.  There’s one in every cohort. Talk to the instructor about it. It’s not really your place to pull him up unless the instructor has given him the hard word. If he still keeps it up, you mind have to band together with other students to shut him down. 

NTA"
dhkf8p,"NTA. She seems insecure about your relationship, probably why she's being controlling. That ain't ok. Also what's the point of keeping streaks just to keep streaks?"
dhkg7b,"YTA

Your fiancee doesn't want to spend the night with you before marriage.

The way you keep bringing up paying for her mother makes it sound like, ""I'm paying for her -- she needs to sleep with me now."""
dhkhaz,YTA for not hitting her with the pads
dhki14,Nta. It's your house. Live it normally. I understand giving them time but they can leave or she has a room.
dhkii4,"You’re not wishing murder on him, just a peaceful death. It’s the best anyone can hope for. NTA"
dhkixb,Obviously oppressive.  But there is no point in fighting about it now.
dhkoj5,"NAH as long as you’re supportive and don’t make him feel bad about transitioning.  Basically you’ve just found out that the person you knew for a long time doesn’t really exist and that someone else was under all that, which can be difficult to wrap your head around.  It’s nobody’s fault but it’s understandable that you’d be upset"
dhkpru,"YTA - Saying it to his face, not over a post on social media, would have been a lot better."
dhksqf,"NTA if you confronted her. It could be best to do some kind of intervention though, since you say she's a hot-headed person."
dhkv4t,"ESH, she was being irresponsible, and you took it a bit too far on the language. I understand that you are scarred from the death of your friend, I really understand that, but you also have to understand that you have to control and respect. You could’ve scolded her and told her your concern, but ask yourself this, was the insulting and profanity really necessary?"
dhl2mw,"NTA.  You are not responsible for supporting your mom.  Because your mom is being unhealthy about it, and I am a mom of kids about your age, I’ll say what she should be saying: Go out and start your life with Kat and don’t worry about home because that’s not your job.  Don’t spend more than you earn, try to build up a decent savings, and be sure to take care of your health even though it seems like you’ll live forever now.  Don’t be a dick and make good choices.  Try to leave a positive mark on the things you do and the people you encounter.  Never ever make a decision based on fear or guilt.  Best of luck to you!"
dhl2rk,Why did u marry this crybaby.
dhl34a,"Not your circus, not your chicken. 

NTA"
dhl4tx,"NTA.

You've made your point clear. They aren't respecting it. Plus you are 22. If you choose to have a family, you have time."
dhl6ox,"NAH you can ask but she is within her rights to say no. Fragrance sensitivity is a thing, and in-between now and the wait for testing (assuming it's like my situation and you're looking at a 3 month wait, lol) you can be doing more in the mean time to manage the situation. 

1. Take a non-drowsy anti allergen in the morning. Every morning. I also have a daily nasal spray.
2. Get a cortisone cream to alleviate the itching symptoms.

Today it's this gals perfume. Tomorrow it might be some rando on the bus or on a night out etc. Best thing you can do for you is not rely on others to change their daily habits and do more to combat it yourself :)"
dhl9fd,"NTA. Gut feelings are real and valid. If you are already feeling uneasy about job #1, then maybe it would be better for you to turn it down. 

Since you haven't officially started working and haven't filled out any employment forms, I think you are totally fine to pursue job #2."
dhld36,"NTA. From the sound of it, they called you just try and get a ride, not to actually see you. If the first thing they said was they needed a ride, they should accept your price. If the Ubers were, in fact, $100 then $45 is still better than taking an Uber. Seeing as they hung up after your response I feel like they were lowballing you and just wanted a cheap ride. Bad friends are the ones who try and take advantage of a friend, they're the ones that need to reevaluate their values.

Edit: Grammar"
dhldxb,"NTA.

You shouldn't have to pay for your sister's medical bills."
dhlkal,[deleted]
dhlki3,"NTA: If it's your house it's respectable that you choose to smoke weed in the house but not cigarettes. It makes sense since the effects of the smoke between weed and cigarettes are drastically different, and it's really fucking hard to get the smell of cigarettes out of the house. It's not a double standard imo"
dhll0u,"NTA. Just say “this is my face, stop asking me questions about how I look.”"
dhlnrj,"NAH, because you are doing it for kind reasons. However, this customer has obviously noticed the preferential treatment and perhaps others have, too. Consider that your other customers might have also had long, difficult days for other reasons (bad medical news or non-health related).  Not everyone's burdens may be as obvious."
dhlofw,NAH it wasn’t the best thing you could’ve said but not terrible and it didn’t cross the line
dhlq9n,"Nta

This sounds toxic and space would probably be good."
dhlsrv,"ESH. The girls you bring over know you live in a shared room and that your roommate isn’t a reflection of you. You can apologize as soon as they walk in and talk about what an asshole your roommate is. But you don’t have a right to dictate what he puts up on his side.

He reacted badly too."
dhlt47,NTA. If I may share a poem: Roses are red/Violets are blue/If you can't post pics/The side chick is you.
dhluii,NTA
dhlvgq,NTA wtf it’s not your responsibility to cook for them
dhlx6w,"YTA

Always ask yourself before speaking : 

1) Is it true

2) Is it necessary

3) Is it kind

4) Is it helpful"
dhm0e9,"NTA- he’s being really selfish. It’s one thing if he would have told you to not worry about him, but he is trying to make sure everyone accommodates him."
dhm2dk,Don't mess with Australians if you can't handle banter. NTA.
dhm4wm,"NTA, everyone flakes sometimes. Besides you've went to his place 5 times already so by the unwritten law of flaking, it's all good."
dhm5x5,"YTA. 

Lots of ASSumptions here. 

Is she smoking? Is she grabbing them for someone else? Her car, you are sure it’s hers she bought brand new? Maybe it was an inheritance, or it’s family/friends car? 

*Edit: maybe she got a really good deal, it happens*


Even if all of your assumptions are correct, why is it any of your business what she does? You had a bad night and took it out on a pregnant lady. Congrats"
dhm7bg,"ESH. He's a douche for giving away your ticket, but don't send texts like ""i'm not mad"" when you are. Be direct and honest if you want your relationship to succeed."
dhm9x3,"NTA and it’s none of your friends business. If your dad wanted to have a relationship with you, he’d make an effort."
dhmb0t,YTA. Nobody expects to lose a bet. That’s why it’s called gambling.
dhmb8q,"INFO: Are you reposting old portraits of your ex or are they just far back in the library of posted portraits? Are the only portraits of these two women or are there also paintings of family, friends, etc?

NTA if she's mad that you aren't deleting old posts. ESH if you're posting or reposting old paintings of your ex while dating the current one."
dhmj69,"ESH. I'd be in the same shoes as the other woman without knowing it was a joke. If all you said was ""It's an inside joke"" and your friend would confirm it, seems like it would've blown over differently."
dhmnky,"NTA
If you have problems with your back then you simply cannot help lifting your mother from point a to point b, simple as that.
You should make that clear to your mother."
dhmnsc,"ESH. It sounds like he could be forgetful based on the fact that you said you reminded him about the event in the first place, so it's clearly unintentional that he invited his fiancee. It's still super frustrating on your end, so it's okay to be upset, just don't hold a grudge - you did a great job getting him a gift he will really enjoy."
dhmq53,"NTA An open relationship can only work, if each partner respects the others boundaries without question. You are now trying to set one, but he is kinda ignoring it. I would talk to him about it again and this time make it as clear as possible how much he is hurtig you and that you want your rare time togethere not be spent texting other people. Maybe he just doesn't get, how much it is bothering you. FWB can wait a few hours."
dhmqxh,"NTA. It’s really disgusting that she smokes inside because it can damage the entire house and all the furniture. Second hand smoke is no joke either, that is dangerous for you too. It’s her choice to smoke but the least she can do is go outside where she won’t be damaging your home or you."
dhmsq1,[deleted]
dhmsxc,NTA She sounds like she’s doing something shady.
dhmt60,"NAH

Your father had well founded fears about you being on social media at a young age. It's not that he doesn't trust you it's that he cannot trust others and being young you are vulnerable prey. No way is this an insult, just a reality. 

If can, talk to both parents about this - preferably together.  Explain what you use it for, what/who you watch, and see if your dad will allow you using it while in public spaces but not in your room. Hopefully you can reach a compromise."
dhmwhu,Info: do you pay rent? Is there any kind of agreement? Or is it just a favor? You are just crashing?
dhmzdj,"NTA. 

I’m in a very very similar situation right now. 
Birthday was on Friday, and the guy I’m seeing didn’t end up coming to the event we had planned to go to. 
You’re allowed to be upset with him, and you’re allowed to not want something that feels forced. 
I absolutely understand wanting to feel special on your birthday. It’s not hard, people just suck."
dhnbjy,"If I’m reading this correctly though, the ones who OP tattled on weren’t the same as the one who pulled out his earphones. That said, OP, YTA. If you want a job in law enforcement, or as a ticket checker, whatever, get one. But otherwise, mind your business. I live in a state where people pull this shit all the time and honestly it gives me creepy vibes. If someone is bothering you, for money or otherwise and they are not injuring your person, use your big boy words to set boundaries. Don’t run to the nearest hall monitor and tattle on somebody who you just don’t like the looks of or whose life choices you don’t condone."
dhncn1,NTA. It's even weirder that she's making up these stories when you're there....
dhnh9z,"NTA. if you don't feel comfortable with your child bring supervised and/or taken care of by these people, that's your business. No justification needed when it comes to the safety of your kid."
dhnif3,"YTA @ D. 

I'm a trans male. It can be quite difficult to remember they/them pronouns, even for me! The fact that S was trying so hard to respect those pronouns that it was noticeable means that she is in fact a pretty awesome ally and she's doing her damn best. Stop berating people who are legitimately trying. 

And using gender neutral pronouns for babies is dumb."
dhnmic,"YTA. Actually, successors can't take chapter specific relics, and the new relic for Iron Hands is pretty damn good.

Just let the guy play what he wants. My game store is 70% Orks. I understand wanting to feel a little more unique but considering the pricey nature of the game, I'd say it's good to let him do what he wants.

I mean if you want my opinion here, everyone here sucks for playing post-rework Iron Hands but whatchagonna do"
dhnsxe,"You don't have to go to every wedding but ""tens of thousands"" of wedding gifts is the most exaggerated thing I have ever heard, or all your friends are just super rich"
dhnwg8,"NAH right now because you haven't discussed it with your friends. If they refuse, then you're NTA."
dhny0i,NAH.  Your boyfriend is being considerate to you.  But you should work on your jealousy issues.
dhnzgj,"NTA 

But could be a good opportunity to try mend any fractures that have happened since living together? Your relationship may be better when you're not all living under one roof."
dhnzyg,NTA.  If someone is making claims they have the burden of proof.
dho9sy,"NTA, there is this thing called CONSENT. Just imagine if everybody would do this. Yes. Everybody."
dhog2i,"NTA, your friend has issues, might wanna find new friends."
dhogo0,"NAH, Don’t worry Pavlov"
dhoiq6,"It sounds like you have been the reasonable and conscientious one from the start and your sister has just been sowing discord. What is her stake in all this, anyway? Why is she so adamant to make your life miserable over the feelings of some corporation?

If you haven't guessed, you are NTA."
dhopa6,Usually gold diggers don't come right out and tell you that that's what they are. NTA
dhoruj,NTA. He's not a friend.
dhotyb,"ESH. 


You were right to be annoyed with her and everything you said was correct, but you should have prioritised making the day nice for your grandmother over your righteous anger. 


There were ways to deal with this without being overtly confrontational and causing a scene. Changing the subject until she gets the message or maybe shutting it down by saying something non aggressive/confrontational like: ""Well, everyone can choose what's right for them. Today's not for debating other people's choices, it's for celebrating grandma! Want some cake?"" 


I have the utmost sympathy for you, but you did screw up a bit."
dhp21a,"NTA.

Just suffer it and throw up on him. I mean you asked him not to and I imagine you explained it makes you feel sick

Go for it. Its not like anyone will blame you for his vindictive cheese and seating choice."
dhp4tz,"I’m saying NTA , you want to be involved, that’s a good thing imo."
