id,comments
djdb6i,"NAH i understand where you are coming from for sure. it’s work to socialize all day long when you’re just not social. 

do whatever makes you and poppop happy, but remember your mom is also going thru a lot of stress watching her father (i assume) go thru something really terrifying. my dad’s going thru colon cancer atm and my mom (who’s admittedly already bonkers) does bonkers stuff and stresses about things that seem unrelated but are very much a projection of her worry for my daddy-o. 

cheers to poppop and daddy-o. cancer sucks."
djdf96,"NTA, this seems like a reasonable solution that still allows people to miss class for religious reasons"
djdfks,"NTA. The moment that Char says that the boyfriend could buy the ticket off her and then she gives it away to someone else is the moment that she becomes the asshole. 

Prior to this, it is an N A H scenario: Char and Laura want a girl’s night and you want your boyfriend there. If Char were to say, “No, your boyfriend can’t have the ticket because I want it to be a girls’ night.” It still would have been N A H. However, she said “Yes” to pretend to accommodate you, hoping that you would not be able to buy a ticket when she got rid of hers, effectively making it impossible for your boyfriend to attend because of the circumstances. You would then let it go as water under the bridge and ignore the skullduggery.

Thankfully, that’s not what happened and you laid bare her asinine behavior. While a friendship with Laura might be salvageable, I could not be a friend with someone like Char who was trying to manipulate and deceive me so brazenly."
djdjfl,"NAH - It sucks, but you're a minor and she has a responsibility to keep you safe, there's a lot of dangerous people on the internet."
djdmik,I’m apparently the oddball saying YTA. If you’re not going on the trip then you have no say in when it happens. You can easily schedule the party for when they’re back. That’s certainly a lot easier than planning a trip.
djdnea,"NTA, you're trying to help your friend, and if you are offering to drive, you can put stipulations on that. However I don't know if this would be the best approach. He has shown he is already willing to drink and drive, so if you make the cost of having a DD too high, he may just go back to drinking and driving, which helps nobody. You should also have a plan for if he agrees to these stipulations, but winds up drinking too much anyway. Because again, having him drive home himself helps nobody."
djdnl3,"YTA

For letting a BABY sleep in a room that sounds like a filthy drug den. The cockroaches are the least of the issue here! Wtf?! How is your mother running a legal daycare with shit like this in the house?? Those poor kids."
djdoxd,"NTA, but borderline ESH.

The dude sounds like an absolute creep, but trying to break his phone is definitely an asshole move. Regardless, you're still in high school, so you have options. Breaking contact is a must, but I don't know if that'll stop the pictures. Asking him to stop clearly isn't enough, so try to be a little more mature about it and talk to your professor."
djdt74,[deleted]
djdukt,"YTA

In life sometimes we try things that aren't right but we don't know it yet. It was a teaching moment. Sounds like you were being a smart ass.

Not to mention the teacher surely tried it and said something like nope that doesn't work, let's try something else. Unless you interrupted before they had a chance to."
djdxtn,"NTA. She is an asshole not for the surgery, but for not owning it and flat-out lying about it. Nothing wrong with getting surgery. Everything wrong with lying about it and telling people you achieved those results via a different way. Own your choices. You have a right to be upset that she lied to you."
dje1ea,"NAH, but timing is

&#x200B;

&#x200B;

everything"
dje93y,"The firm you're working for, if they have business, is making money hand over fist. You're helping them greatly by participating in their most effective cost reduction strategy: robbing their employees.

Some have suggested just quitting. I'm behind that. If you don't stand for yourself, no one will.

If you're too stubborn/scared/complacent to quit, ask for feedback. If they give you good feedback, then you have a reason to ask for more money. If they give you poor feedback, they're not going to give you more money so just quit.

Most companies do a 90 day review, so it might be more appropriate to ask for a raise then. Ask for feedback asap though.

NTA

Fuck, just saw you had a math degree. Definitely quit. You're being pissed on."
djea1i,"Friend! You can do both! In many places, for a nominal fee, you can change your court date. Call them and ask.

If that doesn’t work, nothing wrong with *asking* the teacher for an excused absence for a required court attendance."
djeauo,NTA. They think you can do better so they treat him like crap? That's petty and immature as hell.
djeb00,NTA-I use a wheelchair and sometimes ride the bus. I’ve never cut in front of someone. I’ll get there early to be able to get on first because it’s easier to get a wheelchair on if the bus is empty but I’d never cut in front of someone.
djed20,NTA but you should call back and offer to come consult for $500/hr
djedau,"YTA - A) no one else is expected to pay for your wedding, that hasn't been a ""tradition"" in all the time I've been alive. B) your mom should not be dictating your guest list. You're about to get married, cut the apron strings ffs."
djegda,[deleted]
djeihr,Kinda YTA. Never out anyone until they've clearly told you that it's okay.
djen25,NTA - please report her. People trust medical professionals to keep their mouths shut and it seems like she can't do that.
djexw0,"NTA. Your husband was the one who received the invitation so it's his fault he just ignored it instead of, like, opening his fool mouth one whole time to you or his own blood family to ask about the wedding. Wtf. Perhaps he should be reminded that he is in fact responsible for handling social communications he receives, and they don't just magically re-transmit to the nearest vagina in the house. Sheesh

I also give you a pass for saying it was tacky, because a shitty facebook invite to half a couple only two weeks ahead is basically a nonvitation."
djeyr3,"NTA wtf, you are providing a loving environment for your daughter and he wants to change that? Perhaps he sees this child as more special due to the fact that it is YOU as the biological mother, however, he should value both children equally. You sound like you are doing a wonderful job ensuring that there isn’t any favoritism- keep doing what you’re doing."
djf0e9,"NTA. Holy shit. That’s the worst idea I’ve ever heard. 

“I’d like some drama, with a side order of crazy, and can I get eighteen years of grief for dessert?”"
djf34h,"This is a slippery slope, because he’s not your kid. 

If it’s me, to keep the peace, I wash the dishes and cook this time, but talk to his mom when she gets home and ask her how she wants you to handle it next time. 

NTA"
djf472,"YTA, but if I was in your place I would do nothing different."
djf7n5,"NTA — buy some photos for yourself. And have a serious talk with your boyfriend about how he’s being completely unreasonable and selfish. If he doesn’t want a picture of himself posted that’s reasonable, it’s not reasonable for him to try and control your image."
djf81t,"NTA - You stood up for yourself, there’s nothing wrong with that. If given the choice, most people would prefer to stay with their friends in a hotel room versus people they hardly know. It’s not like it “just worked out that way,” someone legitimately stole your spot."
djf87c,"Even if your current supervisor knows your looking and is supportive of it (which is all odd to me, but that’s irrelevant), YWBTA if you didn’t give notice. Unless you’re ok with burning this bridge....give 2 weeks notice. You’re working in a professional field, you need to act like it. 2 weeks is standard notice for leaving your job. Also, think of how this could look to your new employer when you tell them you can start today, but you’re still actively employed with another company, and not giving them notice. If you’re ok with doing this to your current employer, what would make them think that you don’t have the potential to do it to them? IJS."
djff4z,"YTA.

If she gets there and walks directly back that's a 3 mile walk with a baby and dog. A 3 miles walk with just a dog would probably take a solid hour and cost you more than $20 in many high COL areas.

Letting the dog out or going outside with your son isn't unreasonable, but  you're making a pretty specific request while criticizing her weight and enthusiasm."
djfr4i,"YTA. You offered to help, she said no thank you. Let it go. Jesus."
djfr4h,"You're NTA for asking him nicely. He might not have been aware of your dietary restrictions, but it's common knowledge that it's unsanitary to do something like that."
djfra2,YTA.  Awkward and unnecessarily annoying lol
djfrav,"NTA - you had plans set, it was a special dinner with your GF for your anniversary and you still managed to get family time in. 

You're not the Asshole.

Your guilt tripping mother is. She realizes now she won't be able to control your every move and it caused her to react in this way. She'll get over it.

Just because you're blood with those cousins doesn't make them more important than the ones you love."
djfypg,Info: are you all 12?
djfzvs,NTA. You aren't responsible for their study habits.
djg1ps,"ESH

What a stupid ass, wasteful rule."
djg418,"DUDE. How do you think people communicated hang ups/getting stuck in traffic prior to cell phones? CALL THE RESTAURANT

YTA for not apologizing, but let this be a lesson to both of you on proper communication in the future. She could’ve told you her phone was definitely going to be dead when she didn’t have access to a charger, you could’ve found alternative ways to contact her."
djg7lf,No. Not harsh. She is ELEVEN. Why is she even on that? I’d give her a phone where she could only call family and the police.
djg8z5,"NAH  Find something else you and your other friends will all do together during that time period, you mentioned it's a college town so surely there's lots of activities.

Tell him he's welcome to join you if he wants to take a night off from gaming."
djgcnn,Nah- but you and your jeweler are dolts. You already have her sizing from the ring you were picking up. Why would you need her to go in to get measured?!
djggk0,"NTA do it, record it, and share the recording with us please :)"
djggz6,NTA. Can't leave the stove on without communication.
djgjpc,"NTA. Your father has refused to be a dad since day one. He’s experiencing guilt because he is realizing that he has wasted his life and now has nothing to show for it except two kids that he has a sliver of a relationship with. 
You do NOT have to have a relationship with someone who a) berated and verbally abused your mother, b) refused to pay for your child support, c) and was apathetic to the point where he would’ve had you be homeless. 
You don’t have to force yourself to have a relationship with anyone that you don’t want to."
djgmlx,"NTA. I would absolutely want to know why a long term relationship ended. It’s not like anyone is being hurt more then they already are by you telling the ex why your cousin broke up with her. The ex wasn’t fishing for info, so she’s not using you to get back at him, I think letting her know why it ended will help her heal and move on, there is absolutely nothing assholish about that."
djgn9z,"ESH. Hear me out. You have a lot of animosity towards her cat by even going so far as to call it, ""it"". That's her pet, many consider pets to be family. If she can see how much contention and resentment you have for the cat, I can see her choosing her cat over you because she's not getting rid of her pet but she can end this relationship. I'm not saying that's the right thing to do here. I also don't think her actions are right either. She should be able to compromise on the bed thing. But you know this cat means the world to her.

As a cat owner, when they bestow their attention on you, you don't just take it for granted. My husband would gladly shove me away if it meant one of our cats in particular is laying on him because that one doesn't do it very often if at all.  This is just in reference to the couch situation you mentioned. Personally I don't disturb them and I just sit next to them on the other side of the couch. This cat never does this with me and I don't try and ruin it for him. It's the little things that make him happy.

Have you sat down and explained all these feelings in a calm and non-resentful way? I think you need to think long and hard about if this is going to work communication wise for your relationship. Honestly if I wasn't married and a boyfriend was being a dick to one of my cats, that's not my man anymore. I know it's the same for my husband. I don't think you guys should break up by any means but I do think you need to have a real heart to heart about this. Or maybe she should be coming to your home for sleepovers to balance out how much alone time you guys get. That gives you more time to figure out the cat situation."
djgpmc,"YTA, for a few reasons:

~~1) Keeping a dog kenneled all day is incredibly cruel, especially to a 1 year old collie!~~

~~2) spay your pets for fucks sake~~

3) your neighbors just had a baby and your dog, by your own admission, barks a lot because you have her locked up. 

Find someone to sit your dogs or take them to a doggy daycare or something. You’re making your pets your neighbors problem and that’s asshole behavior.

EDIT: given the additional info, my first 2 points no longer apply"
djgqwe,"NTA. The whole idea was this was a family trip for your now-wife's graduation, not a couple's trip for Jo and Jorge, yes? You and your now-wife were trying to make things fun for everyone, I assume. Why is it up to you to fix anything, when Jorge was acting like a spoiled brat on the trip? What did Susan expect you to do?"
djgsnb,"NTA. The other kid was honestly full A, maybe they liked you or something, maybe not, but that doesn't give them the rights to interject your talk with untrue statements. You technically repeated what they said back to them, so yhea."
djgt2w,"NTA

It’s a known fact you’re a sleepwalker and they purposefully put in hardwood floors. That’s on them. 

Put down some carpets and shake them out outside every week."
djgtiv,"NTA - This sounds like your being pushed into a burnout. Speaking from gone through other types of burnouts this isn’t anything anyone wants. I’m not sure about your age but maybe it’s time to tell the parents that all their behavior is doing is making you not want to dance. If they want you to stay in it then they need to step back and maybe you should take a short break (not long just to get out of the funk) because burnouts are nasty and can take months to bounce back from. 

Also if your Dads been around the block as much as it sounds he should be familiar with the concept of muscle memory. You missing practice or one competition will not undo years of training. Missing several because of a burnout could though. If you want to keep going address this now before it’s too late. 

Also I would be careful about over-stretching past the limit you know you can. You can pull muscles do that. Then you would be out even longer. Something you would think your parents would know anyway..."
djgty1,"NTA.

Talk to the landlord. If you politely explain the situation i'm willing to bet they side with you. I live in a similar type of apartment and I know my landlord would be upset if a guest was leaving the door unlocked all the time."
djgx2w,"NAH. I wouldn't overthink this. As a frequent pedestrian, I'm kinda on his side, but he overreacted. Still just not a big enough deal to really call anyone TA though."
djgzl4,Football pretty conclusively causes brain injury.
djh0hx,"NTA. drop this guy, he’s not your friend."
djh2gg,"NTA. That's a pretty reasonable request. As long as you don't get angry if she refused to do so. Also, the stuff that happens on that computer wont really impact the application on either computer. Sure it might corrupt some files, but only on that computer. 

Source: Computer Nerd."
djh8h1,"ESH

Has no one thought to call Adult Protective Services or even the police non-emergency line? This guy sounds like he’s in a mental health crisis. Getting him help could save all of you the confrontational yelling and threats while maintaining his ability to keep his home. Evicting him is not going to solve the problem - it’s just going to move it."
djhj17,Yta if you dont go to funeral bc of homecoming shit. Nta if you dont go to funeral bc you cant miss those tests. Im sure gma would want you to take those
djhqhd,"NTA, but your parents probably feel like you're missing out by not getting to know your family in Mexico (or at least keeping the door open). If I had to leave my country with my kids, I would be sad if they refused to make the effort to get to know their roots and the people I grew up with.

I respect the fact that you feel like you would be judged if they knew the real you, but you don't even have to approach those topics until you're comfortable."
djhqku,"YTA for that.. wasn’t necessary at all, and you should have her back next time, just like she should have yours. We’re humans, sometimes we’re late for things."
djhxyl,"NTA. It is not unreasonable to stay in a hotel when visiting family, especially considering she doesn’t even have a spare bedroom and you are putting her out (literally).  I would just remain insistent with her that you will be coming for Christmas but prefer the hotel room and so will be doing that. She will come around eventually - I’m sure when push comes to shove she’d rather see you guys than be alone at Christmas. She’ll probably be a pain about it but just dig up all your patience and trudge forward because you’re right, your hubby will likely regret if he doesn’t get the quality time in with his aging mom."
djhygf,"NTA. Seriously - this woman sounds like she's got a screw loose. No way would I let a random stranger feed my dogs ANYTHING. There are crazy people out there who get their jollies by poisoning people's pets. 

While this woman might seem harmless, she is affecting your dogs' health and creating problems in the dog park. Most dog parks specify NO food, no children under a certain age etc. - so she's probably already in breach of the park rules. 

You need to talk to the supervisor about getting this woman banned from the park. It sounds harsh - and she might love the interactions with the dogs - but her behaviour is unsettling (ignoring direct requests etc.) and clearly causing problems."
djhz6s,"NTA why do people always want to try and explain/justify their sex work. You do it, that's it. I feel like trying to explain it kind of further gives the industry a negative connotation"
dji47t,"NTA both parties seem happy with the arrangement. You seem to be doing a good job and they are obviously grateful. Honestly you are 24, can make your own life decisions, and your mother needs to back off a bit and let you handle your own business."
dji80g,ESH because you should talk to your professor about this first.
dji8mz,NTA. She was acting like she was in charge of you guys when she definitely isn’t. Good on you for standing up for yourself.
djift8,NAH - developing new friendships and abandoning old ones is a part of growing up. People change and those you're friends with at one point in your life often aren't the people you want to spend the rest of your  life hanging around. Its possible there was some assholish behaviour all around when it happened but that tends to be the way teenagers behave.
djig29,Don't make it a moral problem if you leave or not.  You don't owe anything to the company you work for. Every day people are resigning because they're fed up working in heavily understaffed shifts or roles. NTA.
djimtk,"YTA, you could just say 'the n word'. You obviously know how hurtful and jarring that word is. If a stranger said it to you and it was shocking, why would you then say it to someone else? You said you wanted them to 'feel the gravity of the situation'. They certainly did after you used a slur and are rightly offended. Completely inappropriate in a work setting and really anywhere. Be more thoughtful next time."
djip8o,"NTA but know that businesses have a shit-ton of tax loopholes, it's very possible that they did nothing wrong in the eyes of the law."
djit4j,"YTA. Why are you still involved with this? You have graduated. I was a high school theatre kid too and went back to visit and say hi occasionally, but I can't imagine actually getting involved with how people interact. Seems a little ""high school glory days"" to me."
djiwj4,"NTA 


Talk to the school administrator and make a complaint. Also, tell your parents and make them aware of the situation. Why the Hell is this woman taking pictures of kids in school?!? Does she work there?"
djj2zx,YTA. Even though he shouldn’t have done that he said sorry and it was just a fry. I wouldn’t let this small argument blow up when it doesn’t seem like a big deal
djjew7,"Definitely NTA.

It's extremely inappropriate to say those jokes at work, especially when you told him NOT to and you don't feel comfortable with him doing so. 

But since you are worried about your mutual friends within the workplace, I would recommend properly talking to him 1-on-1, saying that if he continues to make inappropriate comments, that you'll have to report it to the HR. It seems to take everything as a joke so I wonder how he'll respond in a more serious situation. If he STILL continues to do so, just report him. It seems that other coworkers seem to think it's inappropriate from your explanation."
djjfgu,"YTA, you should have gotten up and left the theatre. It doesn't matter if it took long to reply, people are there to enjoy what's on stage not the light from your phone. People paid money for that and were right to be angry."
djjnw9,"YTA Oh my god, dude.

First of all, you've always planned a bunch of stuff for each other's birthdays so you not doing anything is obviously a slap in the face. Second, she just had a HUGE mental health crisis that forced her to *drop out of school* and you didn't think she might need her partner to show her a little special attention? Third, you didn't think of *something* more personal than an instagram post?? I mean, Jesus.

> she's been at home with basically unlimited free time

Yeah, because she had a breakdown that has shaken up her entire life. You couldn't set aside your studies for one day to make her feel special?"
djjqlw,"YTA

If she's lived with him for three years and had him as primary caretaker, he's her owner/home now.  Plus, if your parents already ""kicked"" Millie out once due to shedding and odor, what makes you think that they'd be okay with you trying to move her back in to the house just because you're there now?

It sucks, losing a pet is hard, but it's not fair to the dog to do this back-and-forth routine every time your parents get sick of her fur/shedding.   Let her stay with your ex where she is comfortable and loved - and get a new dog (if your parents/landlord okay it) that you can learn to love just as much."
djjrqo,NTA. Stick to the facts when they ask you though.
djjrru,"NTA. That’s beyond shitty behaviour and your better off without someone like that in your life. Also, you get to decide who you want to be friends with. That’s the best bit."
djjrxr,"NTA because it's your life, but if you can vote in ways that help the LGBTQA+ cause, take the time to do so if you agree with the specific cause.

This person is trying to make your story part of their narrative.  It's your business."
djjsyy,"NTA. It sounds like ""P' is just having a rough time and his ego was hurt. I think as long as you had good intentions you shouldn't feel like the asshole."
djjtdw,YTA for even thinking about putting your new girlfriend's childish bullshit above the assistance of your actual child.
djjung,"NTA, I wouldn't like that either. No more photos for her."
djjwcs,"NTA- 
My local McDonald’s does this to me alllllll the time with an item called the “classic chicken sandwich”. They say it’s not in the menu and I ask why can I order it for pickup at this location right now on the app? They say it must be a mistake because they don’t have the sandwich available. I complain and speak to a manager and they told me that they didn’t have the sauce that goes on it so therefore it makes it unavailable, that I can totally understand. I tell her I don’t order it with the sauce anyways and if they would just let me order it or tell me they didn’t have the sauce to begin with this could’ve all been avoided. She gives me my sandwich and all is good. Just for shits and gigs 10 minutes later I order it from the app, sauce and all and guess what, they had it. I think a lot of their workers are uninformed about things and it’s incredibly frustrating.
Edit: spelling"
djk1cx,"NTA

I don’t know why or when people decided that gyms are spas. Weights cause noise."
djk8y9,"Would you want a stranger to tell you if your SO was doing this shit?

I would. NTA."
