id,comments
dmp2oh,"NTA. As a consumer you don't want to buy these things, and you're not required to. It sucks that she and her family are struggling financially, but that doesn't mean you have to personally bail her out. She made a business decision completely unrelated to you, whether for good or bad. I could see mentioning to her that if you're ever interested in her products you'd contact her first and ask her not to contact you for sales again if you're worried about going forward."
dmp36z,"NAH, but consider the possibility that she hasn't been intentionally dishonest with you but changed her mind when she met *this* man."
dmp3ug,NTA for locking your own gate even if l of this was not going on. My own gate has always been locked and I don't have neighbors like that at all.
dmp7re,NTA. Preferences are fine and ok. Going on a racist tangent to justify them is not ok
dmphfn,"ESH - The co-worker has an extreme (and wrong) view of harrasment, a guy approaching a woman and talking to them is fine, as long as if she says no he backs off. There's no problem there

But you're also an asshole because you started it with your frankly weird comment about it being inappropriate (it's not) as an attempt to *provoke your co-worker*, bravo on the team building there. Also an asshole to assume a man who would side with her is probably gay, as how could he be straight if he agrees with a woman? Also an asshole to keep saying oh they're single and gonna die alone with cats, like what?"
dmpigv,"I think it's pretty damn obvious that you're not the ass and have absolutely nothing to feel guilty about. She made the choice, not you. As soon as she figures out he's cheating on her she'll probably contact one of you. 

NTA"
dmpk8a,"YTA, reddit is a place to be anonymous if you want to be. You shouldnt be calling people out on stuff like that."
dmpkrw,NTA — Outing someone is absolutely despicable. Don't feel obligated to forgive something like this.
dmpnpv,"INFO — How old are you?  How old is the tenant?

A soft YTA 

Your parents are the landlords. They need to be the ones to handle a potentially serious problem. You don’t want her to go crazy and go confront them over what you said/did and they’ll have no clue what’s going on. 

“Mom/Dad, Miranda is on the phone a lot with her windows open. Sometimes until 1am. She’s swearing and yelling right under my window and below Sister’s room. I know Sister can hear it because we talked about it.  It’s affecting my ability to concentrate, to relax, to study, and to sleep. Can you ask her to close her window when on the phone and not talk so loudly?” 

So, no clutching your pearls that it’s harming Sister (she’s heard it all before), no ultimatums, no whining, **no “confronting”**.  Just here’s the problem, why it’s a problem for me (not Sis), and here’s a solution.  

If they refuse again, it’ll be time to move out. If you can’t do that yet, put on your headphones, turn on a white noise machine, and focus on something else."
dmppaz,"NAH, since some people do get nervous giggles, and you don't seem to have done it with malicious intentions.

Edit: I highly recommend apologizing to the other guy and explaining why this happened, though."
dmptco,Do your work and let her work slack. You can’t just pick it up for her if you expect someone to notice that she’s slacking
dmpuc2,"Nope, just be nice about it: “Hey man, heard you playing the piano, sounds great but ...”"
dmpwkr,YTA. Stealing. That's stealing. Do you want to wait 2 months for this promotion or do you want to get fired?
dmpx4k,"YWBTA. If you take this route all you’ll be doing is doubling down that men don’t have to respect a woman’s no, and only do so if they’re taken or a lesbian.

Stop with the hinting and be straight: message him over the phone, “I’ve been getting the impression by you walking me to my car and messaging me that you’re interested. If my presumptions are correct, I want to be upfront in saying that I’m not interested and I’d prefer if you give me some space.”

If he responds in a way that makes you fearful, save his responses and report them to someone at your school."
dmpzu7,NTA.  Your dad kind of overreacted on his part.  Keep in mind OP that he probably wanted to do something that signifies you entering manhood.  Doesn’t hurt to just let him celebrate his son reaching that point in life.  I mean what do you have to lose?
dmpzzt,NTA - you're not responsible for him and you've done what you could to help him in the past. Are there local services you could direct him to?
dmq191,"YTA
but just for writing ""she couldn't make it cause her mom passed away, cool, things happen"". That's cold."
dmq352,"NTA. I totally get that. Sometimes there are just people you need a break from being around, while others you just need to cut out. Rose is one of those people. Her behavior seems quite rude and I wouldnt want to spend my time around her"
dmq47f,"NTA. That would annoy the fuck outta me lol. As long as you say it politely, I don't think you'd be an asshole. Maybe she really is easily startled, or maybe she does it for some kind of attention, or to be funny or something? Whatever the reason may be, try to express to her that since this seems to occur frequently, it distracts you with your work and wakes you up, etc."
dmq4ct,"ESH. Your wife for putting you on the spot and having you answer questions in front of her family. Although, maybe you should talk to her and tell her to no longer do that. And you, for getting your friends involved and talking about it in a group chat. You could've just told your wife, ""Hey, don't put me on the spot like that please"""
dmq729,"NAH but you should actually talk to him about it.

Also it sounds like his friend sent him a link to a job which makes sense for him to apply to. Maybe you should reframe this, he's not following his friend's advice over you, he's following your advice with the help of his friend."
dmq85k,"NTA. He needs to take a hint and leave you alone. You don't owe him the time of day, much less friendship. I think you handled the situation very gracefully."
dmq8m9,"ESH - sounds like pretty poor dialogue between the both of you. You made an honest mistake that could have ended pretty seriously, and he has every right to be upset. But just being angry and petty with each other isn't going to help either of you."
dmq9xm,"NTA it's your hair, one ""no"" is enough."
dmqb5t,"NTA. However, I got a feeling cops might be the only real way to deal with this."
dmqd4v,"Yes YTA. Mostly for the second part. You know she's not an entitled brat but you were pretty damn rude to her for, let's face it, trying to save your family money."
dmqd93,"Uh, this memorial thing doesn’t sound like the biggest issue here..."
dmqdn8,"How is 6500 for a 12 year old Camry a “great deal”? Even with low miles, the bells and whistles, a 12 year old Camry should not be more than 3K. Sounds like where ever your uncle got this car from *did not* take him out to dinner first or offer him lube. 

NAH. I’m pretty sure he has 7 days to return the vehicle.

EDIT: I just checked the KBB. An 07 Camry XLE with every upgrade possible is only worth 4,000 - 4,870. Your uncle definitely should have asked for lube."
dmqeaw,"I would say given all of this (I’m a teacher btw) you’re NTA. If he’s letting you guys out late all the time which is causing you to be late for class or whatever is next in your day that’s poor organization and planning. And anyone who’s been directing for 20 years should know how to manage time better. 

His wife pulling you aside was dumb. It wasn’t her business and she butted in. 

I’d write all this down with all the details of this particular incident (don’t necessarily go into everyone dislikes him and all that) and talk to admin about it. If there are other instances in which he’s been disrespectful then I’d document those too. 

You’re right that speaking to him in a certain tone is disrespectful on your part but as teachers if we want our students to respect us, escalating the situation by being disrespectful back or being sarcastic or condescending doesn’t help. He’s the teacher. He’s supposed to be the bigger person in this situation."
dmqeeh,"YTA

The ceremony may include religious aspects, but the point is to support your friend getting married and be part of this amazing event in his life. The reception is just a party. You’re being selfish. 

FWIW I’m atheist, and I’ve sat through many religious weddings — and also funerals, Christmas Mass, a Havdalah, a Friends meeting, LDS services, and more. You do it bc you care about them and want to show your support, not bc you believe all the details of their religion (or even any)."
dmqet7,Why does this read like you don't even like her?
dmqf1w,"NTA

There are plenty of ways to remove makeup that don't require wipes. Tell her to Google it."
dmqlaw,"NAH.

I can think of a dozen legitimate reasons for him to do that. If you're worried that he's a threat to you, call the cops; he's on your property. If you're not worried about it, knock on his window and ask what's up."
dmqpr5,"NAH. it’s your choice what she wears as one on your bridesmaids, it’s her choice to decide if she wants to be a bridesmaid if she doesn’t agree with your choices. Though she is being a bit childish as it’s your wedding, not hers"
dmqpv8,"NTA

You 2 could still have fun on the road trip and in the town, I get that he is bummed about the car. However not even trying to save the plans to a degree seems a bit selfish. 

5hrs of driving can be quite tiring in a day, so maybe you could at least go somewhere a bit closer."
dmqq11,"NTA at all. Your Dad should be thinking about your feelings and be making the effort to see you, especially since they pass by regularly. 
Don’t feel bad for how you feel because its 100% understandable."
dmqsjx,"NTA.  He had plenty to eat, your meal was the only thing specifically suited to your diet, he needs a come to Jesus meeting with his folks.

Not to mention, you weren't even parenting him!

BTW, you don't need to censor language--it actually puts in boldface that eats some of your text!"
dmqvlm,"What does being attractive have to do with enjoying their music?  Seems like a really weird time to slip up and talk about how attractive someone is if you've been careful for the last two years.

She sounds overly sensitive, but you knew that.  Id say not the asshole for A, but B and C kinda pushed it into asshole territory.  And in the end it's her opinion that's going to effect your life, not a bunch of internet randos."
dmqvnl,NAH
dmqvo3,ESH. She isn’t following up on her responsibilities but that’s just borderline abuse what you did. Plus think about what your kid thought when they experienced it. Trust me. They heard it
dmqwwv,"Idk, I think you may get in trouble with the law if the person you got them from hasn’t paid for them, then she stole them and your sister is now in possession of stolen animals.

However, I’d say NTA because the animals sound like they weren’t treated very well and I wouldn’t feel comfortable in your position handing them over to anyone other than the proper authorities."
dmr1ng,"YTA. She paid for the policy AND she spent the money on you. 

You sound awfully entitled -- you're upset that she didn't pay for your wedding AND give you a down payment for a house."
dmr4jg,"NAH, perhaps you could come to a compromise? Maybe skip the lipstick (it would probably get licked/smeared especially her being little) and only do a bit of glitter?"
dmr7xg,"NAH — I would try to make a list of what exact items you don’t want moved around and where they go. That way there’s no confusion, but when you present the list, make sure to do a compliment sandwich. 

“Thank y’all so much for doing this. You are worth every penny and we couldn’t do this without you. 

Would you mind not moving these items though? I’m sorry for not saying so sooner, but it’s easier on me if these items stay in these spots.

Again, thank you so much for all your hard work. We’ve been going through a hard time lately, and I don’t know how the house would stay sane.” 

If you really value their service, I would even throw in an edible arrangement or some Starbucks gift cards as a thank you too when it’s closer to the holidays."
dmras9,"NTA, don't even bother looking her way at the wedding. You can maintain a relationship with your father and not your stepmother. His priority should be his relationship with you not her when it comes down to it. Sorry to hear this tho :( I get it"
dmray8," TA. Tell him. ""Okay. good. Then I wont have to drive 80miles to look at some POS again."" Let the other family members that are telling you that you are TA do all that."
dmrbgb,"NTA...fuck them. Leave them be, especially if they live far away. Getting drunk and saying rude stuff is not cool"
dmrd59,"NTA, these ""jokes"" aren't funny and honestly your dad freaking out like that just makes him seem like a real asshole about it. The jokes are not appropriate and make his kids uncomfortable and he, as their father, should not be purposefully making them uncomfortable like that. 

You'd think that he'd realize his mistake when you said it would feel like incest and that's a big fucking problem for him and Jen's relationship. If he doesn't want it to come up again, tell him to shut up with the ""jokes""."
dmrdkl,"ESH. Big time. First of all, you’re talking about smoking and underage drinking and DUI like it’s absolutely nothing. I don’t mean to be offensive but you seriously need better freinds, I do not blame her mom for banning her from contacting you. The mom is only an a hole because she didn’t do the same with the boyfriend.  Otherwise I’d say she’s totally justified. 

But seriously, you’re engaging in criminal activity, including condoning activity which could get someone killed (DUI) and this is what you’re upset about? Seriously? Please, for your sake,  get your priorities straight, and get a more wholesome group of friends."
dmrfnd,"To be honest, it sounds like both of you were just careless, but I'm gonna give you a slight YTA. to It wasn't really your roommate's problem that you forgot your keys, and you could've asked them for a rough timeline for when they'd be back. Especially since she told you she had dinner plans, and would be a while. 

It's not really fair to expect your roommate to drop her plans at the drop of a hat to help you out. And when you're asking a big favor, it's kind of on you to let them know."
dmrgk2,"YTA for unnecessarily inconveniencing everybody else you encounter instead of just going to the bank.

Youve made more lives just a little bit worse when you didnt have to."
dmrht3,NTA thats a lot to put on a young adult and its a terrible way to treat. If your dad is so worried he can uproot his life and move in with her.  You’ll be mad in the future if you don’t go back to California and will associate the home and property left with anger for not going. She even says that she has other people and she will still leave it to you no matter what. Take care of yourself.
dmri9g,"NAH. You’re not TA for being angry because emotional responses are what they are. You would be TA if you said something snarky or ugly about this to any of your friends. You and the friend who extended the extra invite had different understandings of the lunch. If you want an event with just the two friends in the future, be sure to be specific about that."
dmrko9,NTA - Dont give people joke presents if you’re not sure how they’ll react. Also sexualising a baby like that is kind of weird and definitely not a joke most people would be okay with.
dmrkxc,NTA. There is nothing wrong with disowning and discontinuing contact with a neglectful and toxic parent. Also who asks their *child* to help them pay for a divorce after 4 years of not seeing them???
dmrq21,Why would you even go to 3 different bars if you thought she wasn’t interested and using you? After the second bar this is on you.
dmrqwc,because i’m a 17 year old girl that doesn’t know how.
dmrskb,"Yea, YTA. There’s a time and place for educating people, and a Halloween party isn’t it. No one is going to be receptive, and everyone will just be annoyed at you for ruining the party. You won’t be doing the cause any good ..."
dmrxpb,"NTA, it's shitty that he talked crap about you and let her toxic attitude/negativity influence his treatment of you.

But also, you know first hand that your friend is in a toxic, potentially abusive, relationship (don't know the full extent of the toxicity) and his decision to leave has to be his own. I get you trying to help him leave/make a plan, and also the whole concept of ""wasted time"" but i would encourage you not to think of it that way.

You tried to support him, I'm sure his girlfriend ensured isolating him from you was the best means of continuing their partnership because you were playing such an active role in him attempting to end it. You want his best interest, but it sounds like they're displaying codependent mentalities and people in that situation often aren't thinking about best interest. It's about what is comfortable, familiar, and what they've learned to rely on. Not to say you can save him from that - you can't. 

You don't have to feel bad. But if it would make you feel better, you can alwayd let him know you still support/care about him despite the distance. And then, if he ever does decide to leave her permanently on his own, that might help with some closure. Your decision was justified, and you supporting him can happen from far away if he never does move on."
dms0p9,"NTA. Tell them first, that you’re ready to walk away though. Good luck!"
dms0xn,"Usually I'd say that you're the asshole for retaliating unnessecairily 

But in a ""no filter"" house, it should be no filter. He knows what that means. You giving him shit about his sexual habits is absolutely not the same as him giving you shit for your Sexuality. 

NTA because you were able to understand his house rules better than he does."
dms30w,"You two clearly need to learn to communicate.  You need to approach her and thank her for the support, but that you do not want her to have that burden financially."
dms4ts,"YTA -- For this --

*t I am upset at myself because I put myself in the position to be disposable to her.*

Way to make a mountain out of the world's smallest molehill. 

She was in a mtg, then talking to ppl, and you're upset that she didn't check her phone for \*ten minutes\* and thus you're disposable to her, though she had no reason to think you'd be txting her or were waiting. 

Jesus, you went to do something nice , she wasn't where you expected her to be, didn't notice you'd called for \*ten minutes\*, called you back the minute she saw you'd called, and you've turned it into she's the low-key villain and you're the victim."
dms5uq,NTA you should say something or it’ll be your ass on the line when he eventually gets caught by your manager and then  throws you under the bus.
dms6o0,"NTA - The mom's the asshole for giving her kid such a ridiculous name. Oh trust me this isn't the last time someone's gonna laugh, poor boy."
dms6rk,29 years old and she thinks the party will stop for her *when no one is driving*? NTA. How long has she been sober?
dmsavu,YTA for not being honest with her that you weren’t going to pay her back.
dmsbbe,"NTA, I would take that deal in a second.

Being able to afford someone to clean up after me is literally one of my career goals."
dmsbpk,"NTA - ~~esh - He sucks for being homophobic but you're the asshole for stirring the pot. As someone who's queer I get where your coming from, but imagine the situation is flipped, your conservative father keeps starting arguments with your about how wrong it is to be gay. It would get so frustrating to have to deal with that all the time, so guess how he's feeling when you keep nagging him.~~

~~At the same time though, his views are super shitty and I would hate having to hear something like that from my father.~~

Fuck, missed the part where he talks about his beliefs all the time. NTA - If he's dismissing your conversations but keeps bringing up his, that's super shitty. Feel free to keep debating with him."
dmscsb,Yikes. Stop tattooing yourselves out of anger.
dmsf6l,"NTA.

People have child-free local weddings all the time. There's no reason why you should cater to your sister on YOUR wedding day."
dmsi4f,NTA. Some people have in their court orders that mom and dad are names reserved for bio parents
dmsidc,"NTA

I would have left when they brought out the extra table and it wasn’t for me tbh. 

Anyone with an ounce of decency knows that’s completely out of order.

I’m on the fence about not bothering with the wedding at all. 

I’m actually angry on your behalf."
dmsj0w,Nta Michael Farron is the superior order
dmsjbf,"She was either slow, because of the weed, slow because shes dumb, or your joke was shit, either way NTA"
dmsnhr,NTA. Emotional cheating is still cheating.
dmsp7a,"NTA, but why doesn't the host just man up and tell B himself if he's also uncomfortable that she's inviting randos? It is kind of weird to me that most of your close friend group doesn't like it but won't say anything to B about it. Is everyone just super non-confrontational?"
dmspot,"This post has me all sorts of confused. You need to re-word it...

YTA If you’re upset at her; a baby is gonna wanna play with the dog. A 5 year old is gonna wanna play with the dog, IM gonna wanna play with the dog. 
Difference is,  I’m old enough to know you can’t touch a service animal. 

If she was actively working on keeping her baby away from the service animal and she or the child got yelled at then that’s not her fault AT all. 
Not only is that how a baby will learn (but also not for another few years) but it’s also a good training experience for the dog.

No one in this situation needed to be yelled at."
dmsqqf,"ESH, but mostly your wife. You should have asked her first, but given your brother was sick, it's understandable why it was a spur of the moment thing.

Your wife isn't the asshole for not liking kids, but for complaining about it in front of the kid, not communicating that she hates kids... especially while your wife was acting like a kid, she definitely is."
dmss84,There’s no way this really happened. I’m calling bullshit. Oooor you messed up and married into a batshit crazy family.
dmst03,NTA. You sat on the couch as they were LEAVING. I don’t see the issue
dmst2w,"NTA. You have every right not to go to his wedding. I don't care how nasty the divorce was, what he did to your sister was despicable. I don't blame you at all for not wanting to go!"
dmstlg,"NTA, you shouldn’t have to pay for her watch if she chose to wear it during sports. It’s one thing if you are hanging out and someone randomly and aggressively tackles you and breaks your watch when you had no expectation of wrestling or fighting that day. Then I would say you have to pay up. It’s another thing if you know you are going to be playing a sport and can prepare yourself for accidents. Then it’s on her."
dmsup2,"NTA, oh my gosh, I hate managers like that, both as a patron and as an employee. Does she not understand the customer service aspect of the job? If it's in your power to make a customer happy, do it. Geesh."
dmsvbf,Literally anyone can go to family court and get an order for visitation. You don't need an attorney & there are people to help you complete the forms. That would be the appropriate way to see your child.
dmsvxi,"NTA.

You’re allowed to keep things, stories, life situations, to yourself. If she feels comfortable sharing everything then great! That doesn’t mean you’re also required to."
dmt1na,"NTA. Female here.. if that matters. I don’t see how you’d be an asshole at all for asking her if she still wants to go. 
Shoot your shot. Good luck!"
dmt23k,[deleted]
dmt2qm,She is not vegan then....
dmt2r5,She totally tricked you into getting her pregnant. So shes the asshole.
dmt3b5,"NTA. Those ""jokes"" are bordering on harassment. Bringing up her romantic life and making sexual comments when she clearly isn't reciprocating isn't funny. 

I don't know why so many grown adults think ""it's just a joke"" absolves them of any sort of blame. An attempt at humor isn't an excuse to ignore basic decency, social norms or boundaries. Next time, call him out a bit more bluntly on the spot. When he gets upset, tell him you're just joking. He should laugh it off, right?"
dmt4o7,There should be a “You’re A Fucking Idiot” option.
dmt4pe,"NAH. They understood the first time and ended it before midnight, Im sure they'll understand now.

PS: Sounds like you have really good roommates haha, mine would just party till 4am and be like ""oops"""
dmtdww,"YTA, although almost ESH. I totally get where you’re coming from here, she sounds awful, but to say that at her wedding is hardly excusable. Probably should have seen this coming."
dmteun,"I guess that is what you call growing up. I had problem with the same thing when I finished uni and started to build a career. You simply dont have the time to text all day or ""hang out"" (which in my case was just sitting around on a bech talking about bullshit)

How you deal with it is up to you. Some people, me for example, enjoy being alone in my free time, this includes not being glued to a phone screen texting someone/dealing with their problems.

If you don't like being alone, then it's a different story, find friends who lift you up instead of bringing you down. Having a friend/partner should never feel like a chore or bring bad feelings. (atleast in my opinion)

Anyhow, NTA, buddy. Hope shit works out for you."
